{"completeness":{"covered_service_count":2,"declared_operation_manifest_count":0,"event_operations":0,"group_operation_reference_count":0,"http_operations":0,"manifest_operations_without_discovery":0,"missing_declared_operation_manifest_count":0,"missing_group_operation_count":0,"nats_request_reply_operations":0,"operation_kinds":[{"count":0,"type":"http"},{"count":0,"type":"nats_request_reply"},{"count":0,"type":"nats_event_subscriber"},{"count":0,"type":"worker"},{"count":0,"type":"scheduled"}],"operations_blocked":0,"operations_missing_manifests":0,"operations_with_manifests":0,"parsed_operation_manifest_count":0,"scheduled_operations":0,"source_count":2,"total_discovered_operations":0,"uncovered_service_count":0,"unexpected_parsed_operation_manifest_count":0,"worker_operations":0},"content_sha256":"a8030e900bcf9bd9d616cae7267ed1e9036e122c37ccbcf9ae14aa5ab098365c","diagnostics":[{"code":"EDGE_TARGET_UNRESOLVED","edge_id":"edge-7278db7c1253d9ffb27061d550893f377a873192dde8d78ab92ee9908ce450c1","message":"Owner-declared target is unresolved in the captured CURRENT scope.","severity":"BLOCKED"},{"code":"FLEET_SCOPE_UNPROVEN","message":"Export covers the captured CURRENT topology; authoritative full-fleet scope requires a separately reviewed pinned inventory.","severity":"BLOCKED"}],"edges":[{"contract":"alpha","declaration_pins":[{"blob_oid":"ffffffffffffffffffffffffffffffffffffffff","commit_sha":"bbbbbbbbbbbbbbbbbbbbbbbbbbbbbbbbbbbbbbbb","content_sha256":"dddddddddddddddddddddddddddddddddddddddddddddddddddddddddddddddd","path":".ai/architecture/service.yaml","source_identity":"git:github.com/example/consumer"},{"blob_oid":"0000000000000000000000000000000000000000","commit_sha":"cccccccccccccccccccccccccccccccccccccccc","content_sha256":"eeeeeeeeeeeeeeeeeeeeeeeeeeeeeeeeeeeeeeeeeeeeeeeeeeeeeeeeeeeeeeee","path":".ai/architecture/service.yaml","source_identity":"git:github.com/example/provider"}],"direction":"outbound","edge_id":"edge-12f3e54b419b1d7c142b6e6e72ffcba3dec6f75ce2b118aa3e90c4292e658593","external_target":"provider","operation_id":"","relation":"outbound_dependency","source_reference_id":"ref-cdb1701301d2730b671ca1cc78292842fe5c80d2c66e9f6aaec867421ef80bc5","target_reference_id":"ref-6a74acd8a73f32b609b053210be01fd21425c8f6d5d45e678c8bf4786c76642f","transport":"http"},{"contract":"gamma","declaration_pins":[{"blob_oid":"ffffffffffffffffffffffffffffffffffffffff","commit_sha":"bbbbbbbbbbbbbbbbbbbbbbbbbbbbbbbbbbbbbbbb","content_sha256":"dddddddddddddddddddddddddddddddddddddddddddddddddddddddddddddddd","path":".ai/architecture/service.yaml","source_identity":"git:github.com/example/consumer"}],"direction":"outbound","edge_id":"edge-7278db7c1253d9ffb27061d550893f377a873192dde8d78ab92ee9908ce450c1","external_target":"external-api","operation_id":"","relation":"outbound_dependency","source_reference_id":"ref-cdb1701301d2730b671ca1cc78292842fe5c80d2c66e9f6aaec867421ef80bc5","transport":"http"},{"contract":"beta","declaration_pins":[{"blob_oid":"ffffffffffffffffffffffffffffffffffffffff","commit_sha":"bbbbbbbbbbbbbbbbbbbbbbbbbbbbbbbbbbbbbbbb","content_sha256":"dddddddddddddddddddddddddddddddddddddddddddddddddddddddddddddddd","path":".ai/architecture/service.yaml","source_identity":"git:github.com/example/consumer"},{"blob_oid":"0000000000000000000000000000000000000000","commit_sha":"cccccccccccccccccccccccccccccccccccccccc","content_sha256":"eeeeeeeeeeeeeeeeeeeeeeeeeeeeeeeeeeeeeeeeeeeeeeeeeeeeeeeeeeeeeeee","path":".ai/architecture/service.yaml","source_identity":"git:github.com/example/provider"}],"direction":"outbound","edge_id":"edge-979bf67663445abe8e4aacb1d790537b5c2b870405b3363813d887bcf66557a8","external_target":"provider","operation_id":"","relation":"outbound_dependency","source_reference_id":"ref-cdb1701301d2730b671ca1cc78292842fe5c80d2c66e9f6aaec867421ef80bc5","target_reference_id":"ref-6a74acd8a73f32b609b053210be01fd21425c8f6d5d45e678c8bf4786c76642f","transport":"http"}],"mode":"CURRENT","producer":{"commit_sha":"aaaaaaaaaaaaaaaaaaaaaaaaaaaaaaaaaaaaaaaa","repository_id":"bemulima/agent-orchestrator"},"references":[{"commit_sha":"cccccccccccccccccccccccccccccccccccccccc","covered":true,"declaration_pins":[{"blob_oid":"0000000000000000000000000000000000000000","commit_sha":"cccccccccccccccccccccccccccccccccccccccc","content_sha256":"eeeeeeeeeeeeeeeeeeeeeeeeeeeeeeeeeeeeeeeeeeeeeeeeeeeeeeeeeeeeeeee","path":".ai/architecture/service.yaml","source_identity":"git:github.com/example/provider"}],"is_dirty":false,"manifest_id":"provider","reference_id":"ref-6a74acd8a73f32b609b053210be01fd21425c8f6d5d45e678c8bf4786c76642f","repository_role":"service","source_current":true,"source_identity":"git:github.com/example/provider"},{"commit_sha":"bbbbbbbbbbbbbbbbbbbbbbbbbbbbbbbbbbbbbbbb","covered":true,"declaration_pins":[{"blob_oid":"ffffffffffffffffffffffffffffffffffffffff","commit_sha":"bbbbbbbbbbbbbbbbbbbbbbbbbbbbbbbbbbbbbbbb","content_sha256":"dddddddddddddddddddddddddddddddddddddddddddddddddddddddddddddddd","path":".ai/architecture/service.yaml","source_identity":"git:github.com/example/consumer"}],"is_dirty":false,"manifest_id":"consumer","reference_id":"ref-cdb1701301d2730b671ca1cc78292842fe5c80d2c66e9f6aaec867421ef80bc5","repository_role":"service","source_current":true,"source_identity":"git:github.com/example/consumer"}],"schema_version":"architecture-graph.v1"}
